{
  "id": "wp-20260305-field-monitor-phase1-bootstrap-r2",
  "change_type": "feature",
  "orbt_mode": "build",
  "execution_type": "standard",
  "target_repo_alias": "imo-creator",
  "target_branch": "main",
  "architectural_flag": true,
  "requires_pressure_test": true,
  "allowed_paths": ["templates/snap-on/field-monitor/", "migrations/", "changesets/outbox/", ".github/workflows/"],
  "summary": "Field Monitor phase 1 bootstrap requeue: Neon schema + CTB trigger + indexes + Workers monorepo scaffold and wrangler dev readiness.",
  "doctrine_version": "3.5.0",
  "timestamp": "2026-03-05T18:51:07Z",
  "payload": {"process_id": "029ed8c4-238b-4b5e-9611-cb41d7ef57a4", "operational_id": "d1a62e30-4b83-4f7c-a5d9-8e14c3b07f52", "phase": 1},
  "db_required": true,
  "db_targets": ["field_monitor.url_registry", "field_monitor.field_state", "field_monitor.check_log", "field_monitor.error_log", "field_monitor.rate_state"],
  "db_system": "neon",
  "ui_required": false,
  "doc_required": false,
  "container_required": false
}
