{
  "id": "wp-20260304-va-green-bridge-smoke-retest",
  "change_type": "feature",
  "orbt_mode": "operate",
  "execution_type": "standard",
  "target_repo_alias": "company-lifecycle-cl",
  "target_branch": "main",
  "architectural_flag": false,
  "requires_pressure_test": false,
  "allowed_paths": [
    "changesets/outbox/",
    "audit_reports/"
  ],
  "summary": "Run staged Virginia Green bridge smoke re-test after prerequisite fixes: insert D-04 signal into outreach.signal_output, call lcs.bridge_signal_output(), and verify pending lcs.signal_queue row with required mapped/normalized fields.",
  "doctrine_version": "3.5.0",
  "timestamp": "2026-03-04T20:23:47Z",
  "payload": {
    "process_id": "c3a80df1-ffff-4862-b92f-e5dd5c6116a8",
    "operational_id": "c0d45f63-2b17-4e8a-a3c5-7f10e2b94d38",
    "source_intake_packet": "sys/runtime/inbox/planner/c0d45f63-2b17-4e8a-a3c5-7f10e2b94d38.json",
    "depends_on_operational_ids": [
      "f7a12c30-9e84-4b5d-d0f2-4c87b9e61a05",
      "a8b23d41-0f95-4c6e-e1a3-5d98c0f72b16",
      "b9c34e52-1a06-4d7f-f2b4-6e09d1a83c27"
    ],
    "execution_requirements": [
      "Sequential execution with verification gates",
      "Stop on first failure and report exact failure",
      "Report PASS/FAIL per step",
      "Report lcs.bridge_signal_output() returned row count"
    ],
    "validation_fields": [
      "sovereign_company_id",
      "signal_set_hash",
      "source_hub",
      "lifecycle_phase=OUTREACH",
      "channel=MG",
      "lane=MAIN"
    ]
  },
  "db_required": true,
  "db_targets": [
    "outreach.signal_output",
    "lcs.bridge_signal_output",
    "lcs.signal_queue",
    "cl.company_identity"
  ],
  "db_system": "neon",
  "ui_required": false,
  "doc_required": false,
  "container_required": false
}
